Sheet: Payments
A1: From: | B1: TravelVideoStore.com | H1: Print Date: | I1: =TODAY() -> 2008-08-31T00:00:00.000
D2: 2009/03/01 | H2: Period: | I2: =CONCATENATE(TEXT(DATE(YEAR(STARTDATE),MONTH(STARTDATE),DAY(STARTDATE)),DATEFORMAT),CHAR(32),CHAR(45),CHAR(32),TEXT(DATE(YEAR(ENDDATE),MONTH(ENDDATE),DAY(ENDDATE)),DATEFORMAT)) -> 01/01/2008 - 31/01/2008
A3: To: | B3: Amazon EU Sàrl | D3: 2009/03/31 | H3: Vendor Code: | I3: TRAEF
B4: 5 Rue Plaetis, Luxembourg | D4: DD/MM/YYYY | H4: Sales | J4: =NON_VAT_SALES -> 4.5
B5: Advantage Programme | H5: Inventory Adjustments | J5: =NON_VAT_INVENTORYADJUSTMENTS -> 4.5
B6: c/o Accounting Service Centre | H6: Item Supplementals | J6: =NON_VAT_ITEMSUPPLEMENTALS -> 4.5
B7: Patriot Court, 1-9 The Grove | H7: Vendor Supplementals | J7: =VENDORSUPPLEMENTALS -> 4.5
B8: Slough | H8: Total | J8: =TOTAL -> 18
B9: Berks, SL1 1QP
A13: SALES | J13: =IF(ISERROR(SUM(SA_Amount)),0,SUM(SA_Amount)) -> 4.5
A14: Date of Transaction | B14: External ID | C14: ASIN | D14: Catalog Number | E14: Title | F14: List/Dealer Price | G14: Discount | H14: Units | I14: Cost | J14: Amount
A15: 2009-03-02 | B15: 883629489100 | C15: B001BKI6IQ | D15: MLPDVDPELO | E15: Peloponnes Greece [DVD] | F15: 19.95 | G15: 0.35 | H15: 1 | I15: 12.97 | J15: 12.97
A16: 2009-03-02 | B16: 9319302131895 | C16: B001PF74HG | D16: PAPDVD31895 | E16: Melbourne Australia'S Garden City [DVD] | F16: 19.95 | G16: 0.35 | H16: 1 | I16: 12.97 | J16: 12.97
A17: 2009-03-02 | B17: 8697441015285 | C17: B001PF5DG0 | D17: GAPDVD015285 | E17: Virgin Mary [DVD] | F17: 13.3 | G17: 0.35 | H17: 1 | I17: 8.65 | J17: 8.65
A18: 2009-03-02 | B18: 879061007248 | C18: B001PF72JQ | D18: GTRDVD1125 | E18: Global Treasures El Escorial Real Monasterio De San Lorenzo De El Escorial Spain [DVD] [NTSC] | F18: 14.95 | G18: 0.35 | H18: 1 | I18: 9.72 | J18: 9.72
A19: 2009-03-02 | B19: 879061001543 | C19: B000NOKLZM | D19: SDDVDVEGAS | E19: Deserts, Casinos And Ufos Las Vegas [DVD] [NTSC] | F19: 13.3 | G19: 0.35 | H19: 1 | I19: 8.65 | J19: 8.65
A20: 2009-03-02 | B20: 9319302210040 | C20: B001PF74IK | D20: PAPDVD10040 | E20: Canberra Australia'S Capital City [DVD] | F20: 19.95 | G20: 0.35 | H20: 1 | I20: 12.97 | J20: 12.97
A21: 2009-03-03 | B21: 879061003332 | C21: B000O77QWE | D21: NVFDVDNUDE | E21: The Nude Traveller A Bare Necessities Mediterranean Nude Cruise [DVD] [NTSC] | F21: 13.3 | G21: 0.35 | H21: 1 | I21: 8.65 | J21: 8.65
A22: 2009-03-03 | B22: 883629301877 | C22: B0012DUCK2 | D22: NPMDVD123 | E22: Nature Parks Camargue Provence, France [DVD] [NTSC] | F22: 19.99 | G22: 0.35 | H22: 1 | I22: 12.99 | J22: 12.99
A23: 2009-03-04 | B23: 879061007453 | C23: B001PF72P0 | D23: GTRDVD1146 | E23: Global Treasures Alhambra Granada Andalucia, Spain [DVD] [NTSC] | F23: 14.95 | G23: 0.35 | H23: 1 | I23: 9.72 | J23: 9.72
A24: 2009-03-04 | B24: 879061006524 | C24: B001PF7200 | D24: GTRDVD1053 | E24: Global Treasures Acropolis Akropolis Athens, Greece [DVD] [NTSC] | F24: 14.95 | G24: 0.35 | H24: 1 | I24: 9.72 | J24: 9.72
A25: 2009-03-04 | B25: 883629597720 | C25: B001PFBW92 | D25: DAVDVDCA | E25: Destination California [DVD] [NTSC] | F25: 13.3 | G25: 0.35 | H25: 1 | I25: 8.65 | J25: 8.65
A26: 2009-03-04 | B26: 804879038795 | C26: B000TEJF4Y | D26: VEPDVD03879 | E26: Best Of Europe Guide [DVD] [NTSC] | F26: 24.95 | G26: 0.35 | H26: 1 | I26: 16.22 | J26: 16.22
A27: 2009-03-04 | B27: 883629488974 | C27: B001BKKTZE | D27: TVIPDVDSWI | E27: Switzerland Country Of Mountains [DVD] | F27: 16.63 | G27: 0.35 | H27: 1 | I27: 10.81 | J27: 10.81
A28: 2009-03-04 | B28: 883629281650 | C28: B0011TGJKY | D28: 7DYDVD121 | E28: 7 Days Provence France [DVD] [NTSC] | F28: 19.99 | G28: 0.35 | H28: 1 | I28: 12.99 | J28: 12.99
A29: 2009-03-04 | B29: 879061005930 | C29: B001OV4IHU | D29: VPGDVD146 | E29: Vista Point Côte Dazur France [DVD] [NTSC] | F29: 19.99 | G29: 0.35 | H29: 1 | I29: 12.99 | J29: 12.99
A30: 2009-03-06 | B30: 883629488455 | C30: B001PF73LI | D30: FNPDVDTHAI | E30: A Paradise On Earth Phuket, Thailand The Complete Travel Guide To Phuket, Thailand [DVD] [NTSC] | F30: 19.95 | G30: 0.35 | H30: 1 | I30: 12.97 | J30: 12.97
A31: 2009-03-06 | B31: 879061004247 | C31: B001PF712E | D31: FRDVDTUSCAN | E31: Inside The Tuscan Hills The Chianti And Central Tuscany [DVD] [NTSC] | F31: 14.95 | G31: 0.35 | H31: 1 | I31: 9.72 | J31: 9.72
A32: 2009-03-06 | B32: 883629301488 | C32: B0012DT24Y | D32: GOWDVD120 | E32: Gardens Of The World Hollands Tulip Gardens [DVD] [NTSC] | F32: 19.99 | G32: 0.35 | H32: 1 | I32: 12.99 | J32: 12.99
A33: 2009-03-07 | B33: 9789669145628 | C33: 9669145627 | D33: VOVDVD145703 | E33: Lithuania The Country Film [DVD] [NTSC] | F33: 19.95 | G33: 0.35 | H33: 1 | I33: 12.97 | J33: 12.97
A34: 2009-03-07 | B34: 094922624277 | C34: B000LMIFZO | D34: UTDDVD62427 | E34: Take A Tour Of... Las Vegas [DVD] [NTSC] | F34: 14.95 | G34: 0.35 | H34: 1 | I34: 9.72 | J34: 9.72
A35: 2009-03-08 | B35: 879061007484 | C35: B001PF72PU | D35: GTRDVD1149 | E35: Global Treasures Angkor Wat Cambodia [DVD] [NTSC] | F35: 14.95 | G35: 0.35 | H35: 1 | I35: 9.72 | J35: 9.72
A36: 2009-03-08 | B36: 879061005961 | C36: B001OUIKVG | D36: VPGDVD149 | E36: Vista Point Barcelona Spain [DVD] [NTSC] | F36: 19.99 | G36: 0.35 | H36: 1 | I36: 12.99 | J36: 12.99
A37: 2009-03-08 | B37: 827912050684 | C37: B000HJ855G | D37: AIEDVDVOL2 | E37: Adventures In Europe Vol 2 Germany Football, Friends And Bier [DVD] [2008] [NTSC] | F37: 21.99 | G37: 0.35 | H37: 1 | I37: 14.29 | J37: 14.29
A38: 2009-03-08 | B38: 879061004629 | C38: B001PF5D4M | D38: ITFDVD104 | E38: A Doug Jones Travelog Great Cities Of Europe [DVD] [NTSC] | F38: 19.97 | G38: 0.35 | H38: 1 | I38: 12.98 | J38: 12.98
A39: 2009-03-09 | B39: 883629432267 | C39: B000YQUXUC | D39: BAYDVD43226 | E39: City Tour West Los Angeles, Las Vegas And San Francisco [DVD] [NTSC] | F39: 7.99 | G39: 0.35 | H39: 1 | I39: 5.19 | J39: 5.19
A40: 2009-03-09 | B40: 9319302380019 | C40: B001AJ3NXG | D40: PAPDVD80019 | E40: Panorama Australia [DVD] | F40: 13.3 | G40: 0.35 | H40: 1 | I40: 8.65 | J40: 8.65
A41: 2009-03-09 | B41: 879061000362 | C41: B000LJBZOU | D41: BSPDVD306 | E41: Weekend Explorer Cape Cod, Massachusetts [DVD] [NTSC] | F41: 14.95 | G41: 0.35 | H41: 1 | I41: 9.72 | J41: 9.72
A42: 2009-03-09 | B42: 772035001627 | C42: B000SQDS5K | D42: DAVDVDCANROCK | E42: Destination Canadian Rockies [DVD] [2007] [NTSC] | F42: 19.95 | G42: 0.35 | H42: 1 | I42: 12.97 | J42: 12.97
A43: 2009-03-09 | B43: 883629597324 | C43: B001JP6310 | D43: GSEDVDVINES | E43: Vines Down Under Wine Regions Of Australia And New Zealand [DVD] [NTSC] | F43: 24.95 | G43: 0.35 | H43: 1 | I43: 16.22 | J43: 16.22
A44: 2009-03-10 | B44: 883629281261 | C44: B0011TN6WI | D44: 7DYDVD122 | E44: 7 Days Botswana [DVD] [NTSC] | F44: 19.99 | G44: 0.35 | H44: 1 | I44: 12.99 | J44: 12.99
A45: 2009-03-10 | B45: 883629306230 | C45: B0012DP51I | D45: NWGDVD166 | E45: Nature Wonders Kalahari Desert Botswana [DVD] [NTSC] | F45: 14.95 | G45: 0.35 | H45: 1 | I45: 9.72 | J45: 9.72
A46: 2009-03-10 | B46: 883629303581 | C46: B0012DR34K | D46: NPMDVD151 | E46: Nature Parks Kalahari Desert Botswana [DVD] [NTSC] | F46: 19.99 | G46: 0.35 | H46: 1 | I46: 12.99 | J46: 12.99
A47: 2009-03-10 | B47: 883629306445 | C47: B0012DT2GC | D47: NWGDVD177 | E47: Nature Wonders Chobe River Botswana [DVD] [NTSC] | F47: 14.95 | G47: 0.35 | H47: 1 | I47: 9.72 | J47: 9.72
A48: 2009-03-10 | B48: 883629307176 | C48: B0012DT2LW | D48: NWGDVD159 | E48: Nature Wonders Okavango Delta Botswana [DVD] [NTSC] | F48: 14.95 | G48: 0.35 | H48: 1 | I48: 9.72 | J48: 9.72
A49: 2009-03-10 | B49: 883629301822 | C49: B0012DUCL6 | D49: NPMDVD140 | E49: Nature Parks Chobe River Botswana [DVD] [NTSC] | F49: 19.99 | G49: 0.35 | H49: 1 | I49: 12.99 | J49: 12.99
A50: 2009-03-11 | B50: 879061008535 | C50: B001PF73J0 | D50: GTRDVD1254 | E50: Global Treasures Leptis Magna Libya [DVD] [NTSC] | F50: 14.95 | G50: 0.35 | H50: 1 | I50: 9.72 | J50: 9.72
A51: 2009-03-11 | B51: 883629282145 | C51: B0012DT1XG | D51: CDGDVD105 | E51: Cosmos Global Documentaries Alligator [DVD] [NTSC] | F51: 19.99 | G51: 0.35 | H51: 1 | I51: 12.99 | J51: 12.99
A52: 2009-03-11 | B52: 9319302131895 | C52: B001PF74HG | D52: PAPDVD31895 | E52: Melbourne Australia'S Garden City [DVD] | F52: 19.95 | G52: 0.35 | H52: 1 | I52: 12.97 | J52: 12.97
A53: 2009-03-11 | B53: 883629597751 | C53: B001PFBW9C | D53: DAVDVDCAN | E53: Destination Canada [DVD] [NTSC] | F53: 13.32 | G53: 0.35 | H53: 1 | I53: 8.66 | J53: 8.66
A54: 2009-03-12 | B54: 883629281711 | C54: B0011TM1N8 | D54: 7DYDVD134 | E54: 7 Days Sultanate Of Oman [DVD] [NTSC] | F54: 19.99 | G54: 0.35 | H54: 1 | I54: 12.99 | J54: 12.99
A55: 2009-03-12 | B55: 883629597836 | C55: B001PFBWBU | D55: DAVDVDVABC | E55: Destination Vancouver [DVD] [NTSC] | F55: 13.3 | G55: 0.35 | H55: 1 | I55: 8.65 | J55: 8.65
A56: 2009-03-13 | B56: 879061009990 | C56: B001OLKWWK | D56: VPGDVD233 | E56: Vista Point Zanzibar Island Tanzania [DVD] [NTSC] | F56: 19.99 | G56: 0.35 | H56: 1 | I56: 12.99 | J56: 12.99
A57: 2009-03-13 | B57: 883629515229 | C57: B001AHJZV2 | D57: C3DVDSAF | E57: Safari Kenya [DVD] [NTSC] | F57: 19.95 | G57: 0.35 | H57: 1 | I57: 12.97 | J57: 12.97
A58: 2009-03-13 | B58: 879061000973 | C58: B000LNHL4O | D58: RDADVD0973 | E58: Barbados [DVD] [NTSC] | F58: 9.97 | G58: 0.35 | H58: 1 | I58: 6.48 | J58: 6.48
A59: 2009-03-13 | B59: 879061006340 | C59: B001PF71V0 | D59: GTRDVD1035 | E59: Global Treasures Bali Indonesia [DVD] [NTSC] | F59: 14.95 | G59: 0.35 | H59: 1 | I59: 9.72 | J59: 9.72
A60: 2009-03-13 | B60: 879061003233 | C60: B000LKLK3K | D60: PPIDVD110 | E60: Portholetv Grenada: Excursion To ""The Spice Island"" Tours And Attractions [DVD] [NTSC] | F60: 14.99 | G60: 0.35 | H60: 1 | I60: 9.74 | J60: 9.74
A61: 2009-03-13 | B61: 883629307299 | C61: B0011TGJPY | D61: OTTDVD105 | E61: On Tour... Nile Cruise Rendezvous With The Pharaohs [DVD] [NTSC] | F61: 19.99 | G61: 0.35 | H61: 1 | I61: 12.99 | J61: 12.99
A62: 2009-03-13 | B62: 879061003417 | C62: B000LNC7FW | D62: GSEDVDWINE | E62: Exploring French Wine Regions [DVD] [NTSC] | F62: 24.95 | G62: 0.35 | H62: 1 | I62: 16.22 | J62: 16.22
A63: 2009-03-14 | B63: 879061005473 | C63: B001P6FKC6 | D63: TMTDVD105 | E63: Terra Mystica Taj Mahal India [DVD] [NTSC] | F63: 19.99 | G63: 0.35 | H63: 1 | I63: 12.99 | J63: 12.99
A64: 2009-03-16 | B64: 879061008627 | C64: B001ONNY0A | D64: VPGDVD155 | E64: Vista Point Cape Town South Africa [DVD] [NTSC] | F64: 19.99 | G64: 0.35 | H64: 1 | I64: 12.99 | J64: 12.99
A65: 2009-03-16 | B65: 879061005725 | C65: B001P3WSCE | D65: VPGDVD125 | E65: Vista Point Johannesburg South Africa [DVD] [NTSC] | F65: 19.99 | G65: 0.35 | H65: 1 | I65: 12.99 | J65: 12.99
A66: 2009-03-16 | B66: 879061007828 | C66: B001PF72ZA | D66: GTRDVD1183 | E66: Global Treasures Villa Adriana Hadrian'S Villa Rome, Italy [DVD] [NTSC] | F66: 14.95 | G66: 0.35 | H66: 1 | I66: 9.72 | J66: 9.72
A67: 2009-03-16 | B67: 883629282541 | C67: B0012DT2KI | D67: NWGDVD102 | E67: Nature Wonders Monument Valley U.S.A. [DVD] [NTSC] | F67: 14.95 | G67: 0.35 | H67: 1 | I67: 9.72 | J67: 9.72
A68: 2009-03-16 | B68: 879061008801 | C68: B001OQHBF6 | D68: VPGDVD173 | E68: Vista Point Vancouver Canada [DVD] [NTSC] | F68: 19.99 | G68: 0.35 | H68: 1 | I68: 12.99 | J68: 12.99
A69: 2009-03-16 | B69: 879061000225 | C69: B000LNG28K | D69: RDADVDPORTUGAL | E69: The Best Of Portugal [DVD] [NTSC] | F69: 16.67 | G69: 0.35 | H69: 1 | I69: 10.84 | J69: 10.84
A70: 2009-03-16 | B70: 879061007385 | C70: B001PF72N2 | D70: GTRDVD1139 | E70: Global Treasures Suzhou China [DVD] [NTSC] | F70: 14.95 | G70: 0.35 | H70: 1 | I70: 9.72 | J70: 9.72
A71: 2009-03-16 | B71: 879061006883 | C71: B001PF729Q | D71: GTRDVD1089 | E71: Global Treasures Cairo Egypt [DVD] [NTSC] | F71: 14.95 | G71: 0.35 | H71: 1 | I71: 9.72 | J71: 9.72
A72: 2009-03-18 | B72: 879061000362 | C72: B000LJBZOU | D72: BSPDVD306 | E72: Weekend Explorer Cape Cod, Massachusetts [DVD] [NTSC] | F72: 14.95 | G72: 0.35 | H72: 1 | I72: 9.72 | J72: 9.72
A73: 2009-03-18 | B73: 883629597720 | C73: B001PFBW92 | D73: DAVDVDCA | E73: Destination California [DVD] [NTSC] | F73: 13.3 | G73: 0.35 | H73: 1 | I73: 8.65 | J73: 8.65
A74: 2009-03-19 | B74: 879061000447 | C74: B000LGB9IU | D74: BSPDVD209 | E74: Weekend Explorer Conwy, Wales [DVD] [NTSC] | F74: 14.95 | G74: 0.35 | H74: 1 | I74: 9.72 | J74: 9.72
A75: 2009-03-19 | B75: 9319302420029 | C75: B001PF74LW | D75: PAPDVD20029 | E75: Australia'S Birds Animals [DVD] | F75: 19.95 | G75: 0.35 | H75: 1 | I75: 12.97 | J75: 12.97
A76: 2009-03-20 | B76: 879061005565 | C76: B001AYJGPK | D76: VPGDVD109 | E76: Vista Point Bali Indonesia [DVD] [NTSC] | F76: 19.99 | G76: 0.35 | H76: 1 | I76: 12.99 | J76: 12.99
A77: 2009-03-23 | B77: 883629281506 | C77: B0011TM1JM | D77: 7DYDVD102 | E77: 7 Days Kenya [DVD] [NTSC] | F77: 19.99 | G77: 0.35 | H77: 1 | I77: 12.99 | J77: 12.99
A78: 2009-03-23 | B78: 883629306087 | C78: B0012DT2JO | D78: NWGDVD101 | E78: Nature Wonders Massai Mara Kenya [DVD] [NTSC] | F78: 14.95 | G78: 0.35 | H78: 1 | I78: 9.72 | J78: 9.72
A79: 2009-03-24 | B79: 879061006340 | C79: B001PF71V0 | D79: GTRDVD1035 | E79: Global Treasures Bali Indonesia [DVD] [NTSC] | F79: 14.95 | G79: 0.35 | H79: 1 | I79: 9.72 | J79: 9.72
A80: 2009-03-24 | B80: 879061000362 | C80: B000LJBZOU | D80: BSPDVD306 | E80: Weekend Explorer Cape Cod, Massachusetts [DVD] [NTSC] | F80: 14.95 | G80: 0.35 | H80: 1 | I80: 9.72 | J80: 9.72
A81: 2009-03-24 | B81: 883629432267 | C81: B000YQUXUC | D81: BAYDVD43226 | E81: City Tour West Los Angeles, Las Vegas And San Francisco [DVD] [NTSC] | F81: 7.99 | G81: 0.35 | H81: 1 | I81: 5.19 | J81: 5.19
A82: 2009-03-24 | B82: 883629597720 | C82: B001PFBW92 | D82: DAVDVDCA | E82: Destination California [DVD] [NTSC] | F82: 13.3 | G82: 0.35 | H82: 1 | I82: 8.65 | J82: 8.65
A83: 2009-03-24 | B83: 879061001291 | C83: B001PF70OS | D83: C3DVDKENYA | E83: Kenya The Ultimate African Experience [DVD] [NTSC] | F83: 19.95 | G83: 0.35 | H83: 1 | I83: 12.97 | J83: 12.97
A84: 2009-03-24 | B84: 883629306193 | C84: B0012DUCRU | D84: NWGDVD152 | E84: Nature Wonders Kruger Park South Africa [DVD] [NTSC] | F84: 14.95 | G84: 0.35 | H84: 1 | I84: 9.72 | J84: 9.72
A85: 2009-03-25 | B85: 883629689111 | C85: B001PF5DDI | D85: GAPDVDDOCIA | E85: Cappadocia [DVD] | F85: 13.3 | G85: 0.35 | H85: 1 | I85: 8.65 | J85: 8.65
A86: 2009-03-25 | B86: 883629597874 | C86: B001PFBWCE | D86: DAVDVDSANFRAN | E86: Destination San Francisco [DVD] [NTSC] | F86: 13.3 | G86: 0.35 | H86: 1 | I86: 8.65 | J86: 8.65
A87: 2009-03-26 | B87: 883629281629 | C87: B0011TM1L0 | D87: 7DYDVD156 | E87: 7 Days Norway [DVD] [NTSC] | F87: 19.99 | G87: 0.35 | H87: 1 | I87: 12.99 | J87: 12.99
A88: 2009-03-26 | B88: 883629515465 | C88: B001BKKU08 | D88: MLPDVDCRETE | E88: Crete Greece [DVD] | F88: 19.95 | G88: 0.35 | H88: 1 | I88: 12.97 | J88: 12.97
A89: 2009-03-26 | B89: 883629597836 | C89: B001PFBWBU | D89: DAVDVDVABC | E89: Destination Vancouver [DVD] [NTSC] | F89: 13.3 | G89: 0.35 | H89: 1 | I89: 8.65 | J89: 8.65
A90: 2009-03-28 | B90: 879061006500 | C90: B001PF71ZG | D90: GTRDVD1051 | E90: Global Treasures Hermitage St. Petersburg, Russia [DVD] [NTSC] | F90: 14.95 | G90: 0.35 | H90: 1 | I90: 9.72 | J90: 9.72
A91: 2009-03-28 | B91: 883629597072 | C91: B001JP62QG | D91: CTCDVD49465 | E91: World'S Greatest Festivals The Ultimate Guide To New York Fashion Week [DVD] [NTSC] | F91: 14.95 | G91: 0.35 | H91: 1 | I91: 9.72 | J91: 9.72
A92: 2009-03-28 | B92: 883629597713 | C92: B001PFBW8S | D92: DAVDVDBC | E92: Destination British Columbia [DVD] [NTSC] | F92: 13.3 | G92: 0.35 | H92: 1 | I92: 8.65 | J92: 8.65
A93: 2009-03-29 | B93: 883629597720 | C93: B001PFBW92 | D93: DAVDVDCA | E93: Destination California [DVD] [NTSC] | F93: 13.3 | G93: 0.35 | H93: 1 | I93: 8.65 | J93: 8.65
A94: 2009-03-30 | B94: 883629303444 | C94: B0012DP4XC | D94: NPMDVD129 | E94: Nature Parks Nakuru Kenya [DVD] [NTSC] | F94: 19.99 | G94: 0.35 | H94: 1 | I94: 12.99 | J94: 12.99
A95: 2009-03-30 | B95: 879061008627 | C95: B001ONNY0A | D95: VPGDVD155 | E95: Vista Point Cape Town South Africa [DVD] [NTSC] | F95: 19.99 | G95: 0.35 | H95: 1 | I95: 12.99 | J95: 12.99
A96: 2009-03-30 | B96: 879061007422 | C96: B001PF72O6 | D96: GTRDVD1143 | E96: Global Treasures Rhodes Rodos Greece [DVD] [NTSC] | F96: 14.95 | G96: 0.35 | H96: 1 | I96: 9.72 | J96: 9.72
A97: 2009-03-30 | B97: 883629432267 | C97: B000YQUXUC | D97: BAYDVD43226 | E97: City Tour West Los Angeles, Las Vegas And San Francisco [DVD] [NTSC] | F97: 7.99 | G97: 0.35 | H97: 1 | I97: 5.19 | J97: 5.19
A98: 2009-03-30 | B98: 883629597454 | C98: B001PF73TU | D98: LSDVD110 | E98: Let'S Shop Tokyo Japan [DVD] [NTSC] | F98: 19.95 | G98: 0.35 | H98: 1 | I98: 12.97 | J98: 12.97
A99: 2009-03-30 | B99: 879061000270 | C99: B001PFBW7E | D99: CDDVDRUSSIA | E99: Clint Denn'S Cruising Russia St. Petersburg To Moscow On The Volga Neva [DVD] [NTSC] | F99: 16.63 | G99: 0.35 | H99: 1 | I99: 10.81 | J99: 10.81
A100: 2009-03-30 | B100: 879061004704 | C100: B001AIVCHG | D100: TOMDVDONE | E100: Bangkok Bound Transsexuals, Sex Changes Boxing Volume 1 [DVD] [NTSC] | F100: 19.95 | G100: 0.35 | H100: 1 | I100: 12.97 | J100: 12.97
A103: INVENTORY ADJUSTMENTS | J103: =IF(ISERROR(SUM(IA_Amount)),0,SUM(IA_Amount)) -> 4.5
A104: Date of Transaction | B104: External ID | C104: ASIN | D104: Catalog Number | E104: Title | F104: List/Dealer Price | G104: Discount | H104: Units | I104: Cost | J104: Amount
A105: None this period.
A108: ITEM SUPPLEMENTALS | J108: =IF(ISERROR(SUM(IS_Amount)),0,SUM(IS_Amount)) -> 4.5
B109: External ID | C109: ASIN | D109: Catalog Number | E109: Title | F109: List/Dealer Price | G109: Discount | H109: Units | I109: Cost | J109: Amount
A110: None this period.
A113: VENDOR SUPPLEMENTALS | J113: =IF(ISERROR(SUM(VS_Amount)),0,SUM(VS_Amount)) -> 4.5
A114: Payment Reason | J114: Amount
A115: None this period.
A119: Total amount due | J119: =SUM(NON_VAT_SALES,NON_VAT_INVENTORYADJUSTMENTS, NON_VAT_ITEMSUPPLEMENTALS, VENDORSUPPLEMENTALS) -> 18